{
  "$schema": "http://json-schema.org/draft-07/schema#",
  "$id": "https://pentest-lyan/coverage.schema.json",
  "title": "coverage.json",
  "type": "object",
  "additionalProperties": false,
  "required": [
    "modules",
    "features_summary",
    "system_audits",
    "blindspots",
    "page_coverage"
  ],
  "properties": {
    "modules": {
      "type": "array",
      "items": {
        "type": "string",
        "pattern": "^[a-z0-9_]+$"
      },
      "uniqueItems": true
    },
    "features_summary": {
      "type": "array",
      "items": {
        "type": "object",
        "additionalProperties": false,
        "required": [
          "module_id",
          "module_name",
          "feature_id",
          "feature_name",
          "threats_total",
          "threats_tested",
          "results"
        ],
        "properties": {
          "module_id": {
            "type": "string"
          },
          "module_name": {
            "type": "string"
          },
          "feature_id": {
            "type": "string"
          },
          "feature_name": {
            "type": "string"
          },
          "threats_total": {
            "type": "integer",
            "minimum": 0
          },
          "threats_tested": {
            "type": "integer",
            "minimum": 0
          },
          "results": {
            "type": "array",
            "items": {
              "type": "object",
              "required": [
                "threat_id",
                "vuln_type",
                "status"
              ],
              "properties": {
                "threat_id": {
                  "type": "string"
                },
                "vuln_type": {
                  "type": "string"
                },
                "status": {
                  "type": "string",
                  "enum": [
                    "confirmed",
                    "impact_pending",
                    "suspicious",
                    "not_reproduced",
                    "blocked"
                  ]
                },
                "finding_id": {
                  "$ref": "common.schema.json#/definitions/finding_id",
                  "description": "Inherited from findings.json when status=confirmed."
                }
              },
              "additionalProperties": false,
              "allOf": [
                {
                  "if": {
                    "properties": {
                      "status": {
                        "const": "confirmed"
                      }
                    },
                    "required": [
                      "status"
                    ]
                  },
                  "then": {
                    "required": [
                      "finding_id"
                    ]
                  }
                },
                {
                  "if": {
                    "properties": {
                      "status": {
                        "enum": [
                          "impact_pending",
                          "suspicious",
                          "not_reproduced",
                          "blocked"
                        ]
                      }
                    },
                    "required": [
                      "status"
                    ]
                  },
                  "then": {
                    "not": {
                      "required": [
                        "finding_id"
                      ]
                    }
                  }
                }
              ]
            }
          },
          "note": {
            "type": "string"
          }
        }
      }
    },
    "system_audits": {
      "type": "object",
      "additionalProperties": {
        "type": "object",
        "required": [
          "status",
          "result"
        ],
        "properties": {
          "status": {
            "type": "string",
            "enum": [
              "audited",
              "blocked",
              "not_applicable"
            ]
          },
          "result": {
            "type": "string",
            "minLength": 1
          },
          "blocker": {
            "$ref": "common.schema.json#/definitions/blocker"
          }
        },
        "additionalProperties": false,
        "allOf": [
          {
            "if": {
              "properties": {
                "status": {
                  "const": "blocked"
                }
              },
              "required": [
                "status"
              ]
            },
            "then": {
              "required": [
                "blocker"
              ]
            }
          }
        ]
      },
      "minProperties": 1
    },
    "blindspots": {
      "type": "array",
      "items": {
        "type": "object",
        "additionalProperties": false,
        "required": [
          "scope",
          "vuln_type",
          "status",
          "reason"
        ],
        "properties": {
          "scope": {
            "type": "string",
            "enum": [
              "feature",
              "module",
              "page",
              "function",
              "system"
            ]
          },
          "module_id": {
            "$ref": "common.schema.json#/definitions/module_id"
          },
          "feature_id": {
            "type": "string",
            "minLength": 1
          },
          "page_id": {
            "type": "string",
            "minLength": 1
          },
          "func_id": {
            "type": "string",
            "minLength": 1
          },
          "vuln_type": {
            "type": "string",
            "minLength": 1
          },
          "status": {
            "type": "string",
            "enum": [
              "BLOCKED",
              "NEEDS",
              "N/A"
            ]
          },
          "reason": {
            "type": "string",
            "minLength": 1
          }
        },
        "allOf": [
          {
            "if": {
              "properties": {
                "scope": {
                  "const": "feature"
                }
              },
              "required": [
                "scope"
              ]
            },
            "then": {
              "required": [
                "feature_id"
              ]
            }
          },
          {
            "if": {
              "properties": {
                "scope": {
                  "const": "module"
                }
              },
              "required": [
                "scope"
              ]
            },
            "then": {
              "required": [
                "module_id"
              ]
            }
          },
          {
            "if": {
              "properties": {
                "scope": {
                  "const": "page"
                }
              },
              "required": [
                "scope"
              ]
            },
            "then": {
              "required": [
                "page_id"
              ]
            }
          },
          {
            "if": {
              "properties": {
                "scope": {
                  "const": "function"
                }
              },
              "required": [
                "scope"
              ]
            },
            "then": {
              "required": [
                "page_id",
                "func_id"
              ]
            }
          }
        ]
      }
    },
    "page_coverage": {
      "type": "object",
      "additionalProperties": false,
      "required": [
        "pages_total",
        "pages_visited",
        "functions_total",
        "functions_triggered",
        "untriggered"
      ],
      "properties": {
        "pages_total": {
          "type": "integer",
          "minimum": 0
        },
        "pages_visited": {
          "type": "integer",
          "minimum": 0
        },
        "functions_total": {
          "type": "integer",
          "minimum": 0
        },
        "functions_triggered": {
          "type": "integer",
          "minimum": 0
        },
        "untriggered": {
          "type": "array",
          "items": {
            "type": "object",
            "required": [
              "page_id",
              "name",
              "status",
              "reason"
            ],
            "properties": {
              "page_id": {
                "type": "string"
              },
              "func_id": {
                "type": "string"
              },
              "name": {
                "type": "string"
              },
              "status": {
                "type": "string",
                "enum": [
                  "BLOCKED"
                ]
              },
              "reason": {
                "type": "string",
                "minLength": 1
              }
            },
            "additionalProperties": false
          }
        }
      }
    }
  }
}
