{
  "modules": [
    "demo"
  ],
  "features_summary": [
    {
      "module_id": "demo",
      "module_name": "Demo Module",
      "feature_id": "demo_feature_001",
      "feature_name": "View Demo Object",
      "threats_total": 2,
      "threats_tested": 2,
      "results": [
        {
          "threat_id": "T1",
          "vuln_type": "Missing Object-Ownership Validation",
          "status": "confirmed",
          "finding_id": "VULN-001"
        },
        {
          "threat_id": "T2",
          "vuln_type": "Parameter-Type Boundary",
          "status": "not_reproduced"
        }
      ]
    }
  ],
  "system_audits": {
    "CORS": {
      "status": "audited",
      "result": "No exploitable cross-origin read was identified"
    },
    "expert_blind_spot_review": {
      "status": "audited",
      "result": "Revisited discovery assumptions, cross-module chains, alternate protocols, legacy entry points, asynchronous flows, secondary parsers, and client-controlled trust boundaries; viable routes were either dynamically validated in module results or recorded as explicit blind spots."
    }
  },
  "blindspots": [
    {
      "scope": "module",
      "module_id": "demo",
      "vuln_type": "Cross-role authorization coverage",
      "status": "NEEDS",
      "reason": "Only one active account was available, so cross-account role-pair testing was limited."
    }
  ],
  "page_coverage": {
    "pages_total": 1,
    "pages_visited": 1,
    "functions_total": 1,
    "functions_triggered": 1,
    "untriggered": []
  }
}
